{"changes":[],"comparison_limitations":[],"comparison_status":"complete","kind":"diff-report","left_fingerprint":"artifact:fd941a3bbdf2c321726877ee75b6894bc3eef8d9","left_observation_model_version":"phase3-inspect-v2","right_fingerprint":"artifact:3548098d3d59b7439ba96ca9ce055d8bfe6602c9","right_observation_model_version":"phase3-inspect-v2","summary":"no compatibility-significant changes","uncompared_domains":[]}
